{
  "display_name": "Western Europe multi-era geometry + politics v1",
  "do_not_claim": [
    "period-correct province geometry worldwide",
    "Paradox-grade completeness for any single era",
    "legal historical frontiers \u2014 soft hints are illustrative"
  ],
  "eras": [
    {
      "era": "1444",
      "era_geometry_pack_id": "we-1444-v1",
      "geometry_quality_tier": "period-geometry",
      "notes": "EU-leaning start with M15 WE period geometry (Cologne split, Flanders reshape, soft frontiers).",
      "politics_quality_tier": "curated-politics",
      "recommended_profile": "eu-like",
      "scenario_id": "official-1444"
    },
    {
      "era": "1836",
      "era_geometry_pack_id": "we-1836-v1",
      "geometry_quality_tier": "period-geometry",
      "notes": "Victoria-leaning start with Belgian independence / Prussian Rhine soft geometry.",
      "politics_quality_tier": "curated-politics",
      "recommended_profile": "victoria-like",
      "scenario_id": "official-1836"
    },
    {
      "era": "1936",
      "era_geometry_pack_id": "we-1936-v1",
      "geometry_quality_tier": "period-geometry",
      "notes": "HOI-leaning interwar start with Maginot / Rhineland soft geometry.",
      "politics_quality_tier": "curated-politics",
      "recommended_profile": "hoi-like",
      "scenario_id": "official-1936"
    }
  ],
  "migration_notes": {
    "breaking_changes": [
      "we-1444-v1 splits sample_de_rhineland into era_de_cologne + era_de_rhineland_residual.",
      "we-1836-v1 replaces sample_be_flanders with era_be_flanders_1836.",
      "we-1936-v1 replaces sample_de_rhineland with era_de_rhineland_1936 (different from 1444 split)."
    ],
    "consumer_guidance": [
      "Pin game saves and mod data to era province IDs when consuming a period-geometry layer.",
      "Use lineage.json / lineage.csv under eras/<era>/geometry/ to migrate scaffold-only packs.",
      "Rebuild ownership tables after geometry revisions \u2014 politics do not rewrite polygons.",
      "Read region_quality_matrix.json before claiming period geometry outside Western Europe.",
      "Profile alignment: eu-like (1444), victoria-like (1836), hoi-like (1936)."
    ],
    "do_not_claim": [
      "period-correct province geometry worldwide",
      "identical province IDs across all three eras",
      "Paradox-grade HRE / German Confederation / interwar microborders"
    ],
    "lineage_strategy": "Each era-geometry pack emits its own lineage map (scaffold_province_id \u2192 era_province_id). Do not assume era IDs match across 1444/1836/1936. Cross-era analytics should join on scaffold_province_id.",
    "summary": "Scaffold province IDs are the stable cross-era join key. Era geometry packs may split or replace IDs within a version; use each pack's lineage.json to migrate. Politics are scenario overlays rebuilt per era."
  },
  "pack_id": "we-multi-era-v1",
  "priority_region": {
    "bbox": [
      -5.5,
      42.0,
      12.0,
      54.0
    ],
    "id": "western-europe",
    "label": "Western Europe",
    "notes": "M16 multi-era pack covering 1444, 1836, and 1936 for the WE priority region.",
    "parent_country_ids": [
      "FRA",
      "BEL",
      "NLD",
      "LUX",
      "DEU"
    ]
  },
  "region_quality_matrix": [
    {
      "by_era": {
        "1444": {
          "geometry": "period-geometry",
          "politics": "curated-politics"
        },
        "1836": {
          "geometry": "period-geometry",
          "politics": "curated-politics"
        },
        "1936": {
          "geometry": "period-geometry",
          "politics": "curated-politics"
        }
      },
      "label": "Western Europe (priority region)",
      "region_id": "western-europe"
    },
    {
      "by_era": {
        "1444": {
          "geometry": "scaffold-baseline",
          "politics": "curated-politics"
        },
        "1836": {
          "geometry": "scaffold-baseline",
          "politics": "curated-politics"
        },
        "1936": {
          "geometry": "scaffold-baseline",
          "politics": "curated-politics"
        }
      },
      "label": "Europe elevated theaters (outside WE hard overrides)",
      "region_id": "europe-elevated"
    },
    {
      "by_era": {
        "1444": {
          "geometry": "scaffold-baseline",
          "politics": "curated-politics"
        },
        "1836": {
          "geometry": "scaffold-baseline",
          "politics": "curated-politics"
        },
        "1936": {
          "geometry": "scaffold-baseline",
          "politics": "curated-politics"
        }
      },
      "label": "Global major-power tags",
      "region_id": "global-majors"
    },
    {
      "by_era": {
        "1444": {
          "geometry": "scaffold-baseline",
          "politics": "scaffold-baseline"
        },
        "1836": {
          "geometry": "scaffold-baseline",
          "politics": "scaffold-baseline"
        },
        "1936": {
          "geometry": "scaffold-baseline",
          "politics": "scaffold-baseline"
        }
      },
      "label": "Outside elevated theaters",
      "region_id": "rest-of-world"
    }
  ],
  "schema_version": "0.1.0",
  "source_notes": [
    "M16 multi-era packaging over M12\u2013M15 era programs plus official-1936.",
    "Geometry packs are priority-region scoped; politics remain curated overlays on open geodata."
  ]
}
